{
  "$schema": "https://json-schema.org/draft/2020-12/schema",
  "$id": "https://ldktech.dev/schemas/github-role-handoff-v2.schema.json",
  "title": "Linear Role Handoff",
  "type": "object",
  "additionalProperties": false,
  "required": [
    "schemaVersion",
    "kind",
    "type",
    "issueId",
    "fromRole",
    "summary",
    "observedAt",
    "observedState",
    "transition",
    "checks",
    "evidence",
    "delivery",
    "nextAction"
  ],
  "properties": {
    "schemaVersion": {
      "const": 2
    },
    "kind": {
      "const": "github-role-handoff"
    },
    "type": {
      "enum": [
        "handoff",
        "review",
        "delivery",
        "verification",
        "blocked",
        "reconciliation"
      ]
    },
    "issueId": {
      "type": "string",
      "pattern": "^[A-Za-z0-9_.-]+/[A-Za-z0-9_.-]+#[1-9][0-9]*$"
    },
    "fromRole": {
      "$ref": "#/$defs/role"
    },
    "toRole": {
      "$ref": "#/$defs/role"
    },
    "summary": {
      "type": "string",
      "minLength": 1
    },
    "observedAt": {
      "$ref": "#/$defs/timestamp"
    },
    "observedState": {
      "type": "object",
      "additionalProperties": false,
      "required": [
        "issueUpdatedAt",
        "status",
        "logicalState"
      ],
      "properties": {
        "issueUpdatedAt": {
          "$ref": "#/$defs/timestamp"
        },
        "status": {
          "type": "string",
          "minLength": 1
        },
        "logicalState": {
          "$ref": "#/$defs/logicalState"
        }
      }
    },
    "transition": {
      "type": "object",
      "additionalProperties": false,
      "required": [
        "from",
        "to"
      ],
      "properties": {
        "from": {
          "$ref": "#/$defs/logicalState"
        },
        "to": {
          "$ref": "#/$defs/logicalState"
        }
      }
    },
    "deliverables": {
      "type": "array",
      "items": {
        "type": "string",
        "minLength": 1
      }
    },
    "checks": {
      "type": "array",
      "items": {
        "type": "object",
        "additionalProperties": false,
        "required": [
          "item",
          "passed"
        ],
        "properties": {
          "item": {
            "type": "string",
            "minLength": 1
          },
          "passed": {
            "type": "boolean"
          }
        }
      }
    },
    "evidence": {
      "type": "array",
      "items": {
        "type": "object",
        "additionalProperties": false,
        "required": [
          "kind",
          "label",
          "value",
          "visibility"
        ],
        "properties": {
          "kind": {
            "enum": [
              "url",
              "github-resource",
              "commit",
              "text",
              "local-note",
              "local-file",
              "validator",
              "report"
            ]
          },
          "label": {
            "type": "string",
            "minLength": 1
          },
          "value": {
            "type": "string",
            "minLength": 1
          },
          "visibility": {
            "enum": [
              "shared",
              "local"
            ]
          }
        }
      }
    },
    "knownLimitations": {
      "type": "array",
      "items": {
        "type": "string"
      }
    },
    "nextAction": {
      "type": "string",
      "minLength": 1
    },
    "delivery": {
      "$ref": "#/$defs/delivery"
    },
    "review": {
      "type": "object",
      "additionalProperties": false,
      "required": [
        "decision",
        "findings"
      ],
      "properties": {
        "decision": {
          "enum": [
            "passed",
            "changes-requested"
          ]
        },
        "findings": {
          "type": "array",
          "items": {
            "type": "string"
          }
        },
        "independence": {
          "enum": [
            "fresh-session",
            "fresh-subagent",
            "external-reviewer"
          ]
        }
      },
      "allOf": [
        {
          "if": {
            "required": [
              "decision"
            ],
            "properties": {
              "decision": {
                "const": "passed"
              }
            }
          },
          "then": {
            "required": [
              "independence"
            ]
          }
        }
      ]
    },
    "verification": {
      "type": "object",
      "additionalProperties": false,
      "required": [
        "decision"
      ],
      "properties": {
        "decision": {
          "enum": [
            "passed",
            "failed"
          ]
        }
      }
    },
    "blocker": {
      "type": "object",
      "additionalProperties": false,
      "required": [
        "reason",
        "impact",
        "neededFrom",
        "resumeWhen"
      ],
      "properties": {
        "reason": {
          "type": "string",
          "minLength": 1
        },
        "impact": {
          "type": "string",
          "minLength": 1
        },
        "neededFrom": {
          "type": "string",
          "minLength": 1
        },
        "resumeWhen": {
          "type": "string",
          "minLength": 1
        }
      }
    },
    "nextExecution": {
      "type": "object",
      "additionalProperties": false,
      "required": [
        "sessionPolicy",
        "modelClass",
        "effort",
        "reason"
      ],
      "properties": {
        "sessionPolicy": {
          "enum": [
            "reuse",
            "new-preferred",
            "new-required"
          ]
        },
        "modelClass": {
          "enum": [
            "fast",
            "standard",
            "reasoning"
          ]
        },
        "effort": {
          "enum": [
            "low",
            "medium",
            "high"
          ]
        },
        "reason": {
          "type": "string",
          "minLength": 1
        }
      }
    },
    "software": {
      "type": "object",
      "additionalProperties": false,
      "required": [
        "commitSha",
        "branchName",
        "git"
      ],
      "properties": {
        "commitSha": {
          "type": "string",
          "pattern": "^[0-9a-fA-F]{7,64}$"
        },
        "branchName": {
          "type": "string",
          "minLength": 1
        },
        "branchPushed": {
          "type": "boolean"
        },
        "pullRequestUrl": {
          "type": "string",
          "format": "uri"
        },
        "ciStatus": {
          "enum": [
            "passed",
            "failed",
            "pending",
            "not-configured"
          ]
        },
        "git": {
          "type": "object",
          "additionalProperties": false,
          "required": [
            "baselineId",
            "changeBaseSha",
            "scopePaths"
          ],
          "properties": {
            "baselineId": {
              "type": "string",
              "pattern": "^[0-9a-f]{64}$"
            },
            "changeBaseSha": {
              "type": "string",
              "pattern": "^[0-9a-fA-F]{7,64}$"
            },
            "scopePaths": {
              "type": "array",
              "minItems": 1,
              "uniqueItems": true,
              "items": {
                "type": "string",
                "minLength": 1
              }
            }
          }
        }
      }
    },
    "appliedState": {
      "type": "object",
      "additionalProperties": false,
      "required": [
        "issueUpdatedAt",
        "status"
      ],
      "properties": {
        "issueUpdatedAt": {
          "$ref": "#/$defs/timestamp"
        },
        "status": {
          "type": "string",
          "minLength": 1
        }
      },
      "description": "Live issue state re-read after this event's own mutations landed; keeps the handoff fresh for status reporting."
    }
  },
  "$defs": {
    "role": {
      "type": "string",
      "pattern": "^[a-z0-9][a-z0-9-]*$"
    },
    "timestamp": {
      "type": "string",
      "format": "date-time"
    },
    "logicalState": {
      "enum": [
        "refinement",
        "ready",
        "in-progress",
        "in-review",
        "ready-to-deliver",
        "delivery-verification",
        "blocked",
        "done",
        "canceled"
      ]
    },
    "deliveryMode": {
      "enum": [
        "decision",
        "artifact-review",
        "publish",
        "external-action",
        "software-merge",
        "production-release",
        "operations-change"
      ]
    },
    "deliveryCheck": {
      "type": "object",
      "additionalProperties": false,
      "required": [
        "mode",
        "check"
      ],
      "properties": {
        "mode": {
          "$ref": "#/$defs/deliveryMode"
        },
        "check": {
          "type": "string",
          "minLength": 1
        },
        "passed": {
          "type": "boolean"
        }
      }
    },
    "delivery": {
      "type": "object",
      "additionalProperties": false,
      "required": [
        "mode",
        "ownerRole",
        "phase",
        "checks"
      ],
      "properties": {
        "mode": {
          "$ref": "#/$defs/deliveryMode"
        },
        "ownerRole": {
          "$ref": "#/$defs/role"
        },
        "phase": {
          "enum": [
            "review",
            "ready-to-deliver",
            "delivery-verification",
            "complete"
          ]
        },
        "target": {
          "type": "string",
          "minLength": 1
        },
        "checks": {
          "type": "array",
          "minItems": 1,
          "items": {
            "$ref": "#/$defs/deliveryCheck"
          }
        }
      }
    }
  },
  "allOf": [
    {
      "if": {
        "required": [
          "type"
        ],
        "properties": {
          "type": {
            "const": "handoff"
          }
        }
      },
      "then": {
        "required": [
          "toRole",
          "deliverables"
        ],
        "properties": {
          "deliverables": {
            "minItems": 1
          },
          "checks": {
            "minItems": 1
          },
          "evidence": {
            "minItems": 1
          }
        }
      }
    },
    {
      "if": {
        "required": [
          "type"
        ],
        "properties": {
          "type": {
            "const": "review"
          }
        }
      },
      "then": {
        "required": [
          "review"
        ],
        "properties": {
          "checks": {
            "minItems": 1
          },
          "evidence": {
            "minItems": 1
          }
        }
      }
    },
    {
      "if": {
        "required": [
          "type"
        ],
        "properties": {
          "type": {
            "const": "verification"
          }
        }
      },
      "then": {
        "required": [
          "verification"
        ],
        "properties": {
          "checks": {
            "minItems": 1
          },
          "evidence": {
            "minItems": 1,
            "contains": {
              "required": [
                "kind",
                "visibility"
              ],
              "properties": {
                "kind": {
                  "enum": [
                    "url",
                    "github-resource",
                    "commit",
                    "text"
                  ]
                },
                "visibility": {
                  "const": "shared"
                }
              }
            }
          }
        }
      }
    },
    {
      "if": {
        "required": [
          "type"
        ],
        "properties": {
          "type": {
            "const": "blocked"
          }
        }
      },
      "then": {
        "required": [
          "blocker"
        ]
      }
    }
  ]
}
